<?xml version="1.0" encoding="UTF-8"?>
<xmlszamla xmlns="http://www.szamlazz.hu/xmlszamla" xmlns:xsi="http://www.w3.org/2001/XMLSchema-instance" xsi:schemaLocation="http://www.szamlazz.hu/xmlszamla xmlszamla.xsd ">
  <beallitasok>
    <felhasznalo>Kérem töltse ki!</felhasznalo>
    <jelszo>Kérem töltse ki!</jelszo>
    <eszamla>false</eszamla>
    <kulcstartojelszo></kulcstartojelszo>
    <szamlaLetoltes>true</szamlaLetoltes>
    <szamlaLetoltesPld>2</szamlaLetoltesPld>
    <valaszVerzio>1</valaszVerzio>
    <aggregator></aggregator>
  </beallitasok>
  <fejlec>
    <keltDatum>2012-04-12</keltDatum>
    <teljesitesDatum>2012-04-10</teljesitesDatum>
    <fizetesiHataridoDatum>2012-04-20</fizetesiHataridoDatum>
    <fizmod>Átutalás</fizmod>
    <penznem>Ft</penznem>
    <szamlaNyelve>hu</szamlaNyelve>
    <megjegyzes>Számla megjegyzés</megjegyzes>
    <arfolyamBank>MNB</arfolyamBank>
    <arfolyam>0.0</arfolyam>
    <rendelesSzam></rendelesSzam>
    <elolegszamla>false</elolegszamla>
    <vegszamla>false</vegszamla>
    <dijbekero>false</dijbekero>
    <szamlaszamElotag>Kérem töltse ki, vagy hagyja ki!</szamlaszamElotag>
    <fizetve>true</fizetve>
  </fejlec>
  <elado>
    <bank>OBER</bank>
    <bankszamlaszam>11111111-22222222-33333333</bankszamlaszam>
    <emailReplyto></emailReplyto>
    <emailTargy>Számla értesítő</emailTargy>
    <emailSzoveg>Fizesse ki a számlát, különben a mindenkori banki kamat</emailSzoveg>
    <!-- <alairoNeve>Eladó Aláírója</alairoNeve> -->
  </elado>
  <vevo>
    <nev>Kovacs Bt.</nev>
    <irsz>2030</irsz>
    <telepules>Érd</telepules>
    <cim>Tárnoki út 23.</cim>
    <!-- <email>vevoneve@example.org</email> -->
    <!-- <sendEmail>true</sendEmail> -->
    <adoszam>12345678-1-42</adoszam>
    <postazasiNev>Kovács Bt. postázási név</postazasiNev>
    <postazasiIrsz>2040</postazasiIrsz>
    <postazasiTelepules>Budaörs</postazasiTelepules>
    <postazasiCim>Szivárvány utca 8. VI.em. 82.</postazasiCim>
    <!-- <alairoNeve>Vevő Aláírója</alairoNeve> -->
    <!-- <azonosito></azonosito> -->
    <!-- <telefonszam>+3630-555-55-55, Fax:+3623-555-555</telefonszam> -->
    <!-- <megjegyzes>A portáról felszólni a 214-es mellékre.</megjegyzes> -->
  </vevo><!-- Ez nem kötelező szekció, ha fuvarlevelet szeretne nyomtatni kérjük vegye 
              fel a kapcsolatot az ügyfélszolgálattal az info@szamlazz.hu email címen.
  <fuvarlevel>
    <uticel>106</uticel>
    <futarSzolgalat>PPP</futarSzolgalat>
  </fuvarlevel> -->
  <tetelek>
    <tetel>
      <megnevezes>Elado izé</megnevezes>
      <mennyiseg>1.0</mennyiseg>
      <mennyisegiEgyseg>db</mennyisegiEgyseg>
      <nettoEgysegar>10000</nettoEgysegar>
      <afakulcs>27</afakulcs>
      <nettoErtek>10000.0</nettoErtek>
      <afaErtek>2700.0</afaErtek>
      <bruttoErtek>12700.0</bruttoErtek>
      <megjegyzes>tétel megjegyzés 1</megjegyzes>
    </tetel>
    <tetel>
      <megnevezes>Elado izé 2</megnevezes>
      <mennyiseg>2.0</mennyiseg>
      <mennyisegiEgyseg>db</mennyisegiEgyseg>
      <nettoEgysegar>10000</nettoEgysegar>
      <afakulcs>27</afakulcs>
      <nettoErtek>20000.0</nettoErtek>
      <afaErtek>5400.0</afaErtek>
      <bruttoErtek>25400.0</bruttoErtek>
      <megjegyzes>tétel megjegyzés 2</megjegyzes>
    </tetel>
  </tetelek>
</xmlszamla>
